book_id,authors,title,Genres
1,Suzanne Collins,"The Hunger Games (The Hunger Games, #1)",SciFi;Drama
2,"J.K. Rowling, Mary GrandPré","Harry Potter and the Sorcerer's Stone (Harry Potter, #1)",Fantasy;Young-Age
3,Stephenie Meyer,"Twilight (Twilight, #1)",Fantasy
4,Harper Lee,To Kill a Mockingbird,Self-Help;Drama
5,F. Scott Fitzgerald,The Great Gatsby,Drama
6,John Green,The Fault in Our Stars,Romance;Drama
7,J.R.R. Tolkien,The Hobbit,Fantasy
8,J.D. Salinger,The Catcher in the Rye,Classic;Young-Age
9,Dan Brown,"Angels & Demons  (Robert Langdon, #1)",Thriller;Drama
10,Jane Austen,Pride and Prejudice,Drama;Romance
11,Khaled Hosseini,The Kite Runner,Drama;History
12,Veronica Roth,"Divergent (Divergent, #1)",Fantasy;Drama
13,"George Orwell, Erich Fromm, Celâl Üster",1984,Thriller
14,George Orwell,Animal Farm,Drama
15,"Anne Frank, Eleanor Roosevelt, B.M. Mooyaart-Doubleday",The Diary of a Young Girl,Biography
16,"Stieg Larsson, Reg Keeland","The Girl with the Dragon Tattoo (Millennium, #1)",Crime;Thriller;Drama
17,Suzanne Collins,"Catching Fire (The Hunger Games, #2)",SciFi;Drama
18,"J.K. Rowling, Mary GrandPré, Rufus Beck","Harry Potter and the Prisoner of Azkaban (Harry Potter, #3)",Fantasy;Fiction;Young-Age
19,J.R.R. Tolkien,"The Fellowship of the Ring (The Lord of the Rings, #1)",Fantasy
20,Suzanne Collins,"Mockingjay (The Hunger Games, #3)",Fantasy
21,"J.K. Rowling, Mary GrandPré","Harry Potter and the Order of the Phoenix (Harry Potter, #5)",Fantasy
22,Alice Sebold,The Lovely Bones,Psychological;Domestic
23,"J.K. Rowling, Mary GrandPré","Harry Potter and the Chamber of Secrets (Harry Potter, #2)",Fantasy;Young-Age
24,"J.K. Rowling, Mary GrandPré","Harry Potter and the Goblet of Fire (Harry Potter, #4)",Fantasy;Young-Age
25,"J.K. Rowling, Mary GrandPré","Harry Potter and the Deathly Hallows (Harry Potter, #7)",Fantasy;Young-Age
26,Dan Brown,"The Da Vinci Code (Robert Langdon, #2)",Thriller;Drama
27,"J.K. Rowling, Mary GrandPré","Harry Potter and the Half-Blood Prince (Harry Potter, #6)",Fantasy;Young-Age
28,William Golding,Lord of the Flies,Psychological;Young-Age
29,"William Shakespeare, Robert           Jackson",Romeo and Juliet,Romance
30,Gillian Flynn,Gone Girl,Thriller
31,Kathryn Stockett,The Help,History;Fiction
32,John Steinbeck,Of Mice and Men,Drama;Fiction
33,Arthur Golden,Memoirs of a Geisha,Biography
34,E.L. James,"Fifty Shades of Grey (Fifty Shades, #1)",Erotic;Drama
35,"Paulo Coelho, Alan R. Clarke",The Alchemist,Fiction;Fantasy
36,Lois Lowry,"The Giver (The Giver, #1)",Fantasy
37,C.S. Lewis,"The Lion, the Witch, and the Wardrobe (Chronicles of Narnia, #1)",Fantasy
38,Audrey Niffenegger,The Time Traveler's Wife,Romance;SciFi;Fantasy;Domestic
39,George R.R. Martin,"A Game of Thrones (A Song of Ice and Fire, #1)",Fantasy
40,Elizabeth Gilbert,"Eat, Pray, Love",Romance;Drama
41,Rick Riordan,"The Lightning Thief (Percy Jackson and the Olympians, #1)",Fantasy;Thriller
42,Louisa May Alcott,"Little Women (Little Women, #1)",Young-Age;Romance;Drama
43,"Charlotte Brontë, Michael Mason",Jane Eyre,Young-Age;Biography
44,Nicholas Sparks,"The Notebook (The Notebook, #1)",Romance;Drama
45,Yann Martel,Life of Pi,Fantasy;Drama
46,Sara Gruen,Water for Elephants,Romance;Fiction;History
47,Markus Zusak,The Book Thief,Young-Age;History;Fiction
48,Ray Bradbury,Fahrenheit 451,Fantasy;Fiction
49,Stephenie Meyer,"New Moon (Twilight, #2)",Fantasy
50,Shel Silverstein,Where the Sidewalk Ends,Poetry;Kids
51,Cassandra Clare,"City of Bones (The Mortal Instruments, #1)",Fantasy;Kids;Horror
52,Stephenie Meyer,"Eclipse (Twilight, #3)",Fantasy
53,Christopher Paolini,"Eragon (The Inheritance Cycle, #1)",Fantasy
54,Douglas Adams,"The Hitchhiker's Guide to the Galaxy (Hitchhiker's Guide to the Galaxy, #1)",Fantasy;Fiction
55,Aldous Huxley,Brave New World,Fantasy;Fiction
56,Stephenie Meyer,"Breaking Dawn (Twilight, #4)",Fantasy
57,Sue Monk Kidd,The Secret Life of Bees,Young-Age;History;Drama
58,"Mark Twain, John Seelye, Guy Cardwell",The Adventures of Huckleberry Finn,History;Young-Age
59,"E.B. White, Garth Williams, Rosemary Wells",Charlotte's Web,Kids;Fiction
60,Mark Haddon,The Curious Incident of the Dog in the Night-Time,Young-Age;Fiction
61,Paula Hawkins,The Girl on the Train,Thriller;Psychological
62,Philip Pullman,"The Golden Compass (His Dark Materials, #1)",Fantasy
63,"Emily Brontë, Richard J. Dunn",Wuthering Heights,Romance;Drama;Fiction
64,Jodi Picoult,My Sister's Keeper,Drama;Domestic
65,Kurt Vonnegut Jr.,Slaughterhouse-Five,Fiction
66,Margaret Mitchell,Gone with the Wind,Romance;History
67,Khaled Hosseini,A Thousand Splendid Suns,Drama;History
68,Stephen Chbosky,The Perks of Being a Wallflower,Fiction;Young-Age
69,Veronica Roth,"Insurgent (Divergent, #2)",Fantasy;Drama
70,Orson Scott Card,"Ender's Game (Ender's Saga, #1)",SciFi
71,"Mary Wollstonecraft Shelley, Percy Bysshe Shelley, Maurice Hindle",Frankenstein,Horror;Fiction;SciFi
72,Stephen King,The Shining (The Shining #1),Horror;Classic;Thriller
73,Stephenie Meyer,"The Host (The Host, #1)",Romance;Thriller
74,John Green,Looking for Alaska,Kids;Thriller
75,Helen Fielding,"Bridget Jones's Diary (Bridget Jones, #1)",Comedy;Romance;Drama
76,"Jane Austen, Tony Tanner, Ros Ballaster",Sense and Sensibility,Romance
77,"Louis Sachar, Louis Sachar","Holes (Holes, #1)",Comedy;Drama
78,Lauren Weisberger,"The Devil Wears Prada (The Devil Wears Prada, #1)",Drama;Romance
79,"Homer, Robert Fagles, E.V. Rieu, Frédéric Mugler, Bernard Knox",The Odyssey,Poetry
80,"Antoine de Saint-Exupéry, Richard Howard, Dom Marcos Barbosa, Melina Karakosta",The Little Prince,Classic;Young-Age;Psychological
81,Jeannette Walls,The Glass Castle,Biography
82,Jon Krakauer,Into the Wild,Biography
83,"Charles Dickens, Richard Maxwell, Hablot Knight Browne",A Tale of Two Cities,History;Fiction;Drama
84,Michael Crichton,"Jurassic Park (Jurassic Park, #1)",SciFi;Thriller;Fantasy
85,Shel Silverstein,The Giving Tree,Kids
86,John Grisham,A Time to Kill,Thriller
87,"Elie Wiesel, Marion Wiesel",Night (The Night Trilogy #1),Biography
88,John Green,Paper Towns,Kids;Drama
89,William Goldman,The Princess Bride,Romance;Drama
90,S.E. Hinton,The Outsiders,Young-Age;Fiction
91,James Dashner,"The Maze Runner (Maze Runner, #1)",Young-Age;SciFi
92,"Steven D. Levitt, Stephen J. Dubner","Freakonomics: A Rogue Economist Explores the Hidden Side of Everything (Freakonomics, #1)",Self-Help;Academic
93,Frances Hodgson Burnett,The Secret Garden,Kids
94,"Gabriel García Márquez, Gregory Rabassa",One Hundred Years of Solitude,Fantasy
95,"Oscar Wilde, Jeffrey Eugenides",The Picture of Dorian Gray,Fiction
96,E.L. James,"Fifty Shades Freed (Fifty Shades, #3)",Erotic;Drama
97,"Bram Stoker, Nina Auerbach, David J. Skal",Dracula,Horror;Fantasy
98,"Stieg Larsson, Reg Keeland","The Girl Who Played with Fire (Millennium, #2)",Thriller;Drama
99,E.L. James,"Fifty Shades Darker (Fifty Shades, #2)",Erotic;Drama
100,Barbara Kingsolver,The Poisonwood Bible,History;Fiction
101,David Sedaris,Me Talk Pretty One Day,Biography
102,Maurice Sendak,Where the Wild Things Are,Kids;Fantasy
103,"Alexandre Dumas, Robin Buss",The Count of Monte Cristo,History;Fiction
104,Cormac McCarthy,The Road,Fantasy;Fiction
105,Veronica Roth,"Allegiant (Divergent, #3)",Fantasy;Drama
106,Tina Fey,Bossypants,Biography
107,Nicholas Sparks,A Walk to Remember,Romance;Drama
108,Sophie Kinsella,"Confessions of a Shopaholic (Shopaholic, #1)",Romance;Drama
109,"Victor Hugo, Lee Fahnestock, Norman MacAfee",Les Misérables,Drama;History;Classic
110,George R.R. Martin,"A Clash of Kings  (A Song of Ice and Fire, #2)",Fantasy
111,Kim Edwards,"A Clash of Kings  (A Song of Ice and Fire, #2)",Fantasy
112,Jojo Moyes,"Me Before You (Me Before You, #1)",Romance;Drama
113,Joseph Heller,Catch-22,Comedy;Fiction
114,"Mitch Albom, Saulius Dagys",Tuesdays with Morrie,Biography;Fiction
115,Jeffrey Eugenides,Middlesex,Drama
116,"Mark Twain, Guy Cardwell, John Seelye",The Adventures of Tom Sawyer,Kids;Fiction
117,Madeleine L'Engle,"A Wrinkle in Time (A Wrinkle in Time Quintet, #1)",Classic;SciFi;Young-Age;Kids
118,Amy Tan,The Joy Luck Club,Classic;Fiction
119,Margaret Atwood,The Handmaid's Tale,Drama;Fiction
120,Ann Brashares,"The Sisterhood of the Traveling Pants (Sisterhood, #1)",Kids;Fiction
121,"Vladimir Nabokov, Craig Raine",Lolita,Biography;Romance;Comedy
122,"Gregory Maguire, Douglas Smith","Wicked: The Life and Times of the Wicked Witch of the West (The Wicked Years, #1)",Fantasy;SciFi
123,John Grisham,"The Firm (Penguin Readers, Level 5)",Drama
124,Emma Donoghue,Room,Thriller;Drama
125,"William Shakespeare, Richard Andrews, Rex Gibson",Hamlet,Drama;Comedy
126,Frank Herbert,Dune (Dune Chronicles #1),SciFi;Fantasy;Classic
127,Malcolm Gladwell,The Tipping Point: How Little Things Can Make a Big Difference,Self-Help
128,Walter Isaacson,Steve Jobs,Biography
129,Ken Kesey,One Flew Over the Cuckoo's Nest,Drama;Psychological
130,Ernest Hemingway,The Old Man and the Sea,Classic;Fiction
131,John Steinbeck,The Grapes of Wrath,Drama;Fiction
132,Mitch Albom,The Five People You Meet in Heaven,Self-Help;Fiction
133,L.M. Montgomery,"Anne of Green Gables (Anne of Green Gables, #1)",Kids;Classic
134,Cassandra Clare,"City of Glass (The Mortal Instruments, #3)",Kids;Fantasy;Fiction;
135,George R.R. Martin,"A Storm of Swords (A Song of Ice and Fire, #3)",Fantasy
136,Rebecca Wells,Divine Secrets of the Ya-Ya Sisterhood,Comedy;Drama
137,Diana Gabaldon,"Outlander (Outlander, #1)",Romance;History;Fiction
138,"Nathaniel Hawthorne, Thomas E. Connolly, Nina Baym",The Scarlet Letter,Romance;History;Fiction
139,Ransom Riggs,"Miss Peregrine’s Home for Peculiar Children (Miss Peregrine’s Peculiar Children, #1)",Fantasy;Drama
140,"Stieg Larsson, Reg Keeland","The Girl Who Kicked the Hornet's Nest (Millennium, #3)",Fiction;Drama
141,Andy Weir,The Martian,Fiction;Thriller
142,Ken Follett,"The Pillars of the Earth (The Kingsbridge Series, #1)",Fiction
143,Anthony Doerr,All the Light We Cannot See,History
144,Laura Hillenbrand,"Unbroken: A World War II Story of Survival, Resilience, and Redemption",History
145,Dan Brown,Deception Point,Thriller;Drama
146,Donna Tartt,The Goldfinch,Thriller;Fiction
147,Jay Asher,Thirteen Reasons Why,Drama
148,Tracy Chevalier,Girl with a Pearl Earring,Romance;Drama
149,Gayle Forman,"If I Stay (If I Stay, #1)",Romance;Drama
150,Anita Diamant,The Red Tent,History;Fiction
151,Rick Riordan,"The Sea of Monsters (Percy Jackson and the Olympians, #2)",Fantasy;Kids
152,Nicholas Sparks,Dear John,Romance;Drama
153,Cassandra Clare,"City of Ashes (The Mortal Instruments, #2)",Fantasy;Fiction
154,William Shakespeare,Macbeth,Classic;Drama
155,J.R.R. Tolkien,"The Two Towers (The Lord of the Rings, #2)",Fantasy;Thriller
156,Emily Giffin,"Something Borrowed (Darcy & Rachel, #1)",Romance;Drama
157,"Dr. Seuss, לאה נאור",Green Eggs and Ham,Kids
158,"Roald Dahl, Quentin Blake","Charlie and the Chocolate Factory (Charlie Bucket, #1)",Kids;Classic
159,Rick Riordan,"The Battle of the Labyrinth (Percy Jackson and the Olympians, #4)",Fantasy;Kids;Thriller
160,Charles Dickens,Great Expectations,Classic;Fiction
161,J.R.R. Tolkien,"The Return of the King (The Lord of the Rings, #3)",Fantasy;Thriller
162,"Albert Camus, Matthew    Ward",The Stranger,Fiction
163,Rick Riordan,"The Lost Hero (The Heroes of Olympus, #1)",Fantasy;Fiction
164,Rainbow Rowell,Eleanor & Park,Romance;Drama
165,George R.R. Martin,"A Feast for Crows (A Song of Ice and Fire, #4)",Fantasy;Thriller
166,Ally Condie,"Matched (Matched, #1)",Romance;Fantasy
167,Neil Gaiman,"American Gods (American Gods, #1)",Fantasy;Drama
168,"Stephen King, Bernie Wrightson",The Stand,Fantasy;Fiction
169,Nicholas Sparks,The Last Song,Romance;Drama
170,Dan Brown,Digital Fortress,Thriller;Drama
171,"Jane Austen, Fiona Stafford",Emma,Classic;Comedy;Romance;Drama
172,"Leo Tolstoy, Louise Maude, Leo Tolstoj, Aylmer Maude",Anna Karenina,Fiction
173,Anthony Burgess,A Clockwork Orange,Drama;Thriller
174,William Paul Young,The Shack,Drama;Fiction
175,Rick Riordan,"The Last Olympian (Percy Jackson and the Olympians, #5)",Fantasy;Thriller;Kids
176,Stephen King,It,Horror;Thriller
177,"Fyodor Dostoyevsky, David McDuff",Crime and Punishment,Drama;Fiction
178,Sylvia Plath,The Bell Jar,Classic;Romance
179,Frank McCourt,"Angela's Ashes (Frank McCourt, #1)",Biography
180,"Hermann Hesse, Hilda Rosner",Siddhartha,History;Self-Help
181,Truman Capote,In Cold Blood,Fiction;Thriller
182,"Kami Garcia, Margaret Stohl","Beautiful Creatures (Caster Chronicles, #1)",Romance;Fantasy
183,Cassandra Clare,"Clockwork Angel (The Infernal Devices, #1)",Fantasy;Fiction
184,"Roald Dahl, Quentin Blake",Matilda,Kids;Fantasy
185,Erin Morgenstern,The Night Circus,Fantasy
186,Philippa Gregory,"The Other Boleyn Girl (The Plantagenet and Tudor Novels, #9)",Romance;Drama
187,Scott Westerfeld,"Uglies (Uglies, #1)",Fantasy
188,George R.R. Martin,"A Dance with Dragons (A Song of Ice and Fire, #5)",Fantasy;Thriller
189,J.R.R. Tolkien,"The Lord of the Rings (The Lord of the Rings, #1-3)",Fantasy
190,Cheryl Strayed,Wild: From Lost to Found on the Pacific Crest Trail,Biography
191,"Alan Moore, Dave Gibbons, John Higgins",Watchmen,Fiction;Fantasy
192,Patrick Rothfuss,"The Name of the Wind (The Kingkiller Chronicle, #1)",Fantasy
193,Malcolm Gladwell,Outliers: The Story of Success,Self-Help
194,"Herman Melville, Andrew Delbanco, Tom Quirk","Moby-Dick or, The Whale",Classic;Fiction
195,"Mary Ann Shaffer, Annie Barrows",The Guernsey Literary and Potato Peel Pie Society,History;Fiction
196,Chuck Palahniuk,Fight Club,Comedy;Drama
197,Charlaine Harris,"Dead Until Dark (Sookie Stackhouse, #1)",Romance;Fantasy;Fiction
198,Alice Walker,The Color Purple,Drama;History;Fiction
199,John Grogan,Marley and Me: Life and Love With the World's Worst Dog,Biography
200,Agatha Christie,And Then There Were None,Kids;Fiction
201,Dan Brown,"The Lost Symbol (Robert Langdon, #3)",Thriller;Drama
202,Becca Fitzpatrick,"Hush, Hush (Hush, Hush, #1)",Horror;Drama
203,Jamie McGuire,"Beautiful Disaster (Beautiful, #1)",Romance;Drama
204,Charles Dickens,A Christmas Carol,Fantasy
205,Anne Rice,"Interview with the Vampire (The Vampire Chronicles, #1)",Horror;Fantasy;Drama
206,Kiera Cass,"The Selection (The Selection, #1)",Fantasy;Young-Age;Romance
207,Janet Evanovich,"One for the Money (Stephanie Plum, #1)",Crime
208,Rebecca Skloot,The Immortal Life of Henrietta Lacks,Biography
209,Thomas Harris,"The Silence of the Lambs  (Hannibal Lecter, #2)",Crime;Drama
210,Richelle Mead,"Vampire Academy (Vampire Academy, #1)",Horror;Fantasy;Drama
211,Malcolm Gladwell,Blink: The Power of Thinking Without Thinking,Self-Help
212,Ian McEwan,Atonement,Psychological
213,"Franz Kafka, Stanley Corngold",The Metamorphosis,Comedy;SciFi
214,Rick Riordan,"The Titan's Curse (Percy Jackson and the Olympians, #3)",Fantasy;Kids;Thriller
215,Ernest Cline,Ready Player One,SciFi;Fantasy
216,Garth Stein,The Art of Racing in the Rain,Fiction
217,"Erik Larson, Tony Goldwyn","The Devil in the White City: Murder, Magic, and Madness at the Fair That Changed America",History
218,Sylvia Day,"Bared to You (Crossfire, #1)",Erotic;Romance
219,"C.S. Lewis, Pauline Baynes","The Chronicles of Narnia (Chronicles of Narnia, #1-7)",Fantasy;Kids
220,Mark Cotta Vaz,Twilight: The Complete Illustrated Movie Companion,Fantasy;Romance
221,Dave Pelzer,"A Child Called ""It"" (Dave Pelzer #1)",Biography;Kids
222,Robert Ludlum,"The Bourne Identity (Jason Bourne, #1)",Thriller;Fiction
223,Eoin Colfer,"Artemis Fowl (Artemis Fowl, #1)",Young-Age;Fantasy
224,Lauren Kate,"Fallen (Fallen, #1)",Young-Age;Fantasy;Romance;Horror
225,John Steinbeck,East of Eden,Romance;Fiction
226,Gillian Flynn,Dark Places,Thriller;Drama
227,John Grisham,The Client,Thriller;Drama;Fiction
228,"Emma McLaughlin, Nicola Kraus","The Nanny Diaries (Nanny, #1)",Comedy;Drama
229,"Lewis Carroll, John Tenniel, Martin Gardner",Alice's Adventures in Wonderland & Through the Looking-Glass,Kids;Fantasy
230,"Jane Austen, James Kinsley, Deidre Shauna Lynch",Persuasion,Classic;History;Romance
231,Tatiana de Rosnay,Sarah's Key,History
232,Stephen King,"The Gunslinger (The Dark Tower, #1)",Fantasy;Fiction
233,"Gabriel García Márquez, Edith Grossman",Love in the Time of Cholera,Romance;Fantasy
234,Laurie Halse Anderson,Speak,Young-Age;Drama
235,Liane Moriarty,The Husband's Secret,Thriller
236,Jon Krakauer,Into Thin Air: A Personal Account of the Mount Everest Disaster,Biography;History
237,Stephen King,Carrie,Horror;Thriller;Drama;SciFi
238,Augusten Burroughs,Running with Scissors,Biography
239,Max Brooks,World War Z: An Oral History of the Zombie War,Horror;Fiction
240,Dan Brown,"Inferno (Robert Langdon, #4)",Thriller;Fiction
241,Lois Lowry,Number the Stars,History;Fiction
242,James Patterson,"Along Came a Spider (Alex Cross, #1)",Crime;Thriller
243,Stephen King,Misery,Psychological;Horror
244,Gillian Flynn,Sharp Objects,Thriller;Fiction
245,Katherine Paterson,Bridge to Terabithia,Kids
246,"P.C. Cast, Kristin Cast","Marked (House of Night, #1)",Young-Age;Romance
247,Stephen R. Covey,The 7 Habits of Highly Effective People: Powerful Lessons in Personal Change,Self-Help
248,"William Shakespeare, Barbara A. Mowat, Paul Werstine, Catherine Belsey",A Midsummer Night's Dream,Comedy;Fantasy
249,Jonathan Safran Foer,Extremely Loud and Incredibly Close,Fiction;History
250,R.J. Palacio,Wonder,Drama
251,Dr. Seuss,The Cat in the Hat,Kids
252,Marissa Meyer,"Cinder (The Lunar Chronicles, #1)",Fantasy;Romance
253,"Robert Galbraith, J.K. Rowling","The Cuckoo's Calling (Cormoran Strike, #1)",Thriller;Fantasy
254,Maggie Stiefvater,"Shiver (The Wolves of Mercy Falls, #1)",Fantasy
255,"Ayn Rand, Leonard Peikoff",Atlas Shrugged,Thriller;Romance;Fantasy
256,"Greg Mortenson, David Oliver Relin",Three Cups of Tea: One Man's Mission to Promote Peace ... One School at a Time,Biography
257,"Jane Carruth, Lewis Carroll, Rene Cloke",Alice in Wonderland,Fantasy;Drama
258,"Carlos Ruiz Zafón, Lucia Graves","The Shadow of the Wind (The Cemetery of Forgotten Books,  #1)",Thriller;Fantasy
259,James Dashner,"The Scorch Trials (Maze Runner, #2)",Fantasy;Thriller
260,Dale Carnegie,How to Win Friends and Influence People,Self-Help
261,Frances Mayes,Under the Tuscan Sun,Romance;Self-Help
262,Liane Moriarty,Big Little Lies,Drama;Thriller
263,Gail Carson Levine,Ella Enchanted,Fiction
264,Ernest Hemingway,The Sun Also Rises,Fiction
265,Betty  Smith,A Tree Grows in Brooklyn,Fiction
266,James Patterson,"Kiss the Girls (Alex Cross, #2)",Thriller
267,Kristin Hannah,The Nightingale,Fiction;Biography
268,Kazuo Ishiguro,Never Let Me Go,Drama
269,Cecelia Ahern,P.S. I Love You,Romance;Drama
270,"Daphne du Maurier, Sally Beauman",Rebecca,Thriller;Romance
271,Daniel Keyes,Flowers for Algernon,Fiction
272,"Laura Esquivel, Thomas  Christensen, Carol Christensen",Like Water for Chocolate,Romance;Drama
273,Lisa See,Snow Flower and the Secret Fan,Fiction
274,"Mario Puzo, Robert Thompson, Peter Bart",The Godfather,Thriller;Drama
275,John Green,An Abundance of Katherines,Romance
276,Isaac Asimov,Foundation (Foundation #1),Fiction
277,Neil Gaiman,The Ocean at the End of the Lane,Horror;Fantasy
278,Shel Silverstein,A Light in the Attic,Fantasy;Fiction
279,"John Tiffany, Jack Thorne, J.K. Rowling","Harry Potter and the Cursed Child - Parts One and Two (Harry Potter, #8)",Fantasy;Fiction
280,Lauren Oliver,"Delirium (Delirium, #1)",Romance
281,John Grisham,The Pelican Brief,Thriller
282,Neil Gaiman,Coraline,Fantasy
283,"Terry Pratchett, Neil Gaiman","Good Omens: The Nice and Accurate Prophecies of Agnes Nutter, Witch",Fantasy
284,Jack Kerouac,On the Road,Fiction
285,Graeme Simsion,"The Rosie Project (Don Tillman, #1)",Romance
286,Nicholas Sparks,The Lucky One,Romance;Drama
287,"Ayn Rand, Leonard Peikoff",The Fountainhead,Fiction;Self-Help
288,Tom Clancy,"The Hunt for Red October (Jack Ryan Universe, #4)",Fiction;Thriller
289,Richard Adams,"Watership Down (Watership Down, #1)",Fiction;Fantasy
290,Mindy Kaling,Is Everyone Hanging Out Without Me? (And Other Concerns),Biography
291,Abraham Verghese,Cutting for Stone,Fiction
292,"C.S. Lewis, Pauline Baynes","The Voyage of the Dawn Treader (Chronicles of Narnia, #3)",Fantasy
293,Robert Louis Stevenson,Treasure Island,Kids;Fiction;Thriller
294,Rick Riordan,"The Son of Neptune (The Heroes of Olympus, #2)",Fiction;Kids
295,Stephen King,11/22/63,Fantasy
296,Eric Carle,The Very Hungry Caterpillar Board Book,Kids
297,Kurt Vonnegut Jr.,Cat's Cradle,Fiction
298,"H.G. Wells, Greg Bear, Carlo Pagetti",The Time Machine,Fantasy
299,"Todd Burpo, Lynn Vincent",Heaven is for Real: A Little Boy's Astounding Story of His Trip to Heaven and Back,Kids;Drama
300,John Boyne,The Boy in the Striped Pajamas,Drama;History
301,Joseph Conrad,Heart of Darkness,History
302,Nicholas Sparks,Safe Haven,Drama;Romance
303,Rhonda Byrne,"The Secret (The Secret, #1)",Self-Help
304,Wally Lamb,I Know This Much Is True,Fiction
305,Stephen King,Pet Sematary,Drama
306,Wally Lamb,She's Come Undone,Drama
307,Patrick Rothfuss,"The Wise Man's Fear (The Kingkiller Chronicle, #2)",Fantasy
308,Sophie Kinsella,Can You Keep a Secret?,Fiction;Drama
309,Cassandra Clare,"City of Fallen Angels (The Mortal Instruments, #4)",Fantasy
310,Jennifer Weiner,"Good in Bed (Cannie Shapiro, #1)",Fiction;Romance
311,Colleen McCullough,The Thorn Birds,Drama
312,"Neil Gaiman, Dave McKean",The Graveyard Book,Kids;Fantasy
313,M.L. Stedman,The Light Between Oceans,Drama;Romance
314,"Cornelia Funke, Anthea Bell","Inkheart (Inkworld, #1)",Kids;Fantasy
315,"Spencer Johnson, Kenneth H. Blanchard",Who Moved My Cheese?,Fiction;Self-Help
316,Bill Bryson,A Walk in the Woods,Biography;Drama
317,Maya Angelou,I Know Why the Caged Bird Sings,Biography
318,Christina Baker Kline,Orphan Train,History;Fiction
319,Cassandra Clare,"City of Lost Souls (The Mortal Instruments, #5)",Fantasy
320,Maria Semple,"Where'd You Go, Bernadette",Fiction
321,Wilson Rawls,Where the Red Fern Grows,Kids
322,Neil Gaiman,Neverwhere,Fantasy
323,"Milan Kundera, Michael Henry Heim",The Unbearable Lightness of Being,Fiction;Self-Help
324,Rainbow Rowell,Fangirl,Fiction;Kids
325,John Irving,A Prayer for Owen Meany,Fiction
326,Janet Fitch,White Oleander,Fiction;Drama
327,Marie Lu,"Legend (Legend, #1)",Romance;Fantasy
328,Jodi Picoult,Nineteen Minutes,Thriller
329,"Randy Pausch, Jeffrey Zaslow",The Last Lecture,Self-Help;Academic
330,Robert Jordan,"The Eye of the World (Wheel of Time, #1)",Kids;Fantasy;Fiction
331,Jodi Picoult,The Pact,Thriller;Horror
332,C.S. Lewis,"The Magician's Nephew (Chronicles of Narnia, #6)",Kids;Fantasy
333,Lisa Genova,Still Alice,Drama
334,Sylvia Day,"Reflected in You (Crossfire, #2)",Romance;Erotic
335,"Roald Dahl, Quentin Blake",James and the Giant Peach,Fantasy
336,James Patterson,"1st to Die (Women's Murder Club, #1)",Thriller;Fiction
337,Douglas Adams,The Ultimate Hitchhiker's Guide to the Galaxy,Fantasy;Fiction
338,David Nicholls,One Day,Drama;Romance
339,"Margaret Wise Brown, Clement Hurd",Goodnight Moon,Kids
340,Pittacus Lore,"I Am Number Four (Lorien Legacies, #1)",Romance;Fantasy
341,"Homer, Robert Fagles, Frédéric Mugler, Bernard Knox",The Iliad,Poetry
342,J.K. Rowling,The Casual Vacancy,Fiction;Drama
343,John Grisham,The Runaway Jury,Thriller;Fiction
344,David Sedaris,Naked,Fiction
345,Christopher Paolini,"Eldest (The Inheritance Cycle, #2)",Fantasy;Fiction
346,"L. Frank Baum, W.W. Denslow","The Wonderful Wizard of Oz (Oz, #1)",Kids;Drama
347,C.S. Lewis,"Prince Caspian (Chronicles of Narnia, #2)",Kids;Fantasy
348,E. Lockhart,We Were Liars,Kids;Fiction
349,Stephen King,Salem's Lot,Horror;Fiction
350,"Hunter S. Thompson, Ralph Steadman",Fear and Loathing in Las Vegas,Drama
351,Cassandra Clare,"Clockwork Prince (The Infernal Devices, #2)",Kids;Fiction
352,Amy Poehler,Yes Please,Biography
353,William Shakespeare,Othello,Classic
354,Toni Morrison,Beloved,Fiction;Fantasy
355,Kristin Cashore,"Graceling (Graceling Realm, #1)",Fantasy;Romance;Fiction
356,"Lemony Snicket, Brett Helquist","The Bad Beginning (A Series of Unfortunate Events, #1)",Fiction;Thriller
357,"Erich Maria Remarque, A.W. Wheen",All Quiet on the Western Front,History
358,Dr. Seuss,"Oh, The Places You'll Go!",Kids
359,Khaled Hosseini,And the Mountains Echoed,Fiction;History
360,"Philip K. Dick, Roger Zelazny",Do Androids Dream of Electric Sheep?,Fantasy;Fiction
361,"Charles Dickens, George Cruikshank, Philip Horne",Oliver Twist,Kids;Fiction
362,C.S. Lewis,The Screwtape Letters,Drama;History
363,Stephanie Perkins,"Anna and the French Kiss (Anna and the French Kiss, #1)",Fiction;Romance
364,Dr. Seuss,How the Grinch Stole Christmas!,Kids;Fantasy
365,"Alan Moore, David   Lloyd",V for Vendetta,Thriller
366,David McCullough,John Adams,Biography
367,Dean Koontz,"Odd Thomas (Odd Thomas, #1)",Horror;Thriller
368,Philip Pullman,"The Subtle Knife (His Dark Materials, #2)",Kids;Fantasy
369,Jerry Spinelli,"Stargirl (Stargirl, #1)",Fiction;Romance
370,Rick Riordan,"The Red Pyramid (Kane Chronicles, #1)",Fantasy
371,Robert A. Heinlein,Stranger in a Strange Land,Fantasy
372,David Sedaris,Dress Your Family in Corduroy and Denim,Academic
373,"Roald Dahl, Quentin Blake",The BFG,Kids;Fiction
374,Bill Bryson,A Short History of Nearly Everything,History
375,Jack London,The Call of the Wild,Fiction
376,James Dashner,"The Death Cure (Maze Runner, #3)",Fantasy;Kids
377,Neil Gaiman,Stardust,Fantasy;Romance
378,Jhumpa Lahiri,The Namesake,Drama
379,Deborah Harkness,"A Discovery of Witches (All Souls Trilogy, #1)",Fantasy;Romance;Fiction
380,"Haruki Murakami, Jay Rubin",Norwegian Wood,Drama;Erotic
